<?xml version="1.0" encoding="UTF-8"?>
<epjpakkeliste xmlns="http://schema.arkivverket.no/epjark/epjpakkeliste"
 xmlns:xsi="http://www.w3.org/2001/XMLSchema-instance"
 xsi:schemaLocation="http://schema.arkivverket.no/epjark/epjpakkeliste 
 file:/J:/Arkivfag/schemas/epjpakkeliste.xsd">
    
    <AvleveringsID>2.16.578.1.39.100.11.2.1234.5678</AvleveringsID>
    <ansvarligPerson>Henrik Arkivar</ansvarligPerson>
    <kontaktInformasjon>henark@friskvik.hsx.no</kontaktInformasjon>
    <beskrivelseLagringsEnhet>NHN</beskrivelseLagringsEnhet>
    <antallLagringsenheter>1</antallLagringsenheter>
    <klarforOverforingDato>2016-03-18</klarforOverforingDato>
    <pakke>
        <pakketype>dok</pakketype>
        <filReferanse>fff8eeba-26aa-2853-f4dd-ec34fb28c81e.tar</filReferanse>
        <pakketDato>2018-04-05</pakketDato>
        <sjekksum>4e29ae5f29ac728b4bfacc12e669878fe509572b0808b112c1447a1539834387</sjekksum>
    </pakke>
    <pakke>
        <pakketype>epj</pakketype>
        <filReferanse>f7abbfb5-7b48-df29-550e-80b1fb7e75e5.tar</filReferanse>
        <pakketDato>2016-10-14</pakketDato>
        <sjekksum>1b3ef4952e87d42eb86077eb1c5b9e5f2c78108c1aa2e980b19981fa0cbfdc86</sjekksum>
    </pakke>
    <pakke>
        <pakketype>epj</pakketype>
        <filReferanse>c0b96193-cecb-1a76-d0d7-df2b0fd6bec8.tar</filReferanse>
        <pakketDato>2017-12-11</pakketDato>
        <sjekksum>62b4b149d8ebdc13ea57319a2bd659d13b4b36c90a034a633fbe05b4f598f729</sjekksum>
    </pakke>
</epjpakkeliste>
